{
  "$schema": "https://json-schema.org/draft/2020-12/schema",
  "$id": "https://ghassenelkamel.github.io/portfolio-content/schemas/contact.schema.json",
  "type": "object",
  "additionalProperties": false,
  "required": [
    "schemaVersion",
    "updatedAt",
    "eyebrow",
    "title",
    "description",
    "email",
    "linkedin",
    "github",
    "portfolio"
  ],
  "properties": {
    "schemaVersion": { "const": 1 },
    "updatedAt": {
      "type": "string",
      "pattern": "^\\d{4}-\\d{2}-\\d{2}T\\d{2}:\\d{2}:\\d{2}Z$"
    },
    "eyebrow": { "type": "string", "minLength": 1 },
    "title": { "type": "string", "minLength": 1 },
    "description": { "type": "string", "minLength": 1 },
    "email": { "type": "string", "format": "email" },
    "linkedin": { "type": "string", "format": "uri" },
    "github": { "type": "string", "format": "uri" },
    "portfolio": { "type": "string", "format": "uri" }
  }
}
