{
  "schemaVersion": 1,
  "updatedAt": "2026-04-26T10:00:00Z",
  "eyebrow": "Contact",
  "title": "Professional Reach",
  "description": "Select a contact channel to discuss scope, impact, and collaboration.",
  "email": "Ghassenelkamel@live.fr",
  "linkedin": "https://linkedin.com/in/ghassenelkamel",
  "github": "https://github.com/ghassenelkamel",
  "portfolio": "https://ghassenelkamel.fr"
}
