{
  "schemaVersion": 1,
  "updatedAt": "2026-05-02T18:00:00Z",
  "eyebrow": "Contact",
  "title": "Canaux Professionnels",
  "description": "Choisissez un canal pour discuter du scope, de l'impact et d'une collaboration.",
  "email": "Ghassenelkamel@live.fr",
  "linkedin": "https://linkedin.com/in/ghassenelkamel",
  "github": "https://github.com/ghassenelkamel",
  "portfolio": "https://ghassenelkamel.fr"
}
